{
  "version": 1,
  "levelDamageMult": [
    1,
    1.15,
    1.32,
    1.52,
    1.75
  ],
  "levelRateMult": [
    1,
    1.04,
    1.08,
    1.12,
    1.16
  ],
  "spreadValues": {
    "low": 0.045,
    "med": 0.07,
    "high": 0.11,
    "cone": 0.14
  },
  "maxMuzzleClimb": 0.05,
  "critMultiplier": 2,
  "baseCritChance": 0.05,
  "shakeByClass": {
    "pistol": 0.02,
    "smg": 0.035,
    "rifle": 0.05,
    "shotgun": 0.09,
    "lmg": 0.07
  },
  "weapons": [
    {
      "id": "pistol_9",
      "displayName": "9mm Pistol",
      "fireMode": "semi",
      "damage": 10,
      "pellets": 1,
      "ratePerSec": 3,
      "spread": "low",
      "mag": 15,
      "reloadSec": 1.0,
      "rangeM": 18,
      "rarity": "common",
      "pierce": 0,
      "critBonus": 0,
      "knockback": 0,
      "slowMult": 1,
      "muzzleClimb": 0,
      "class": "pistol",
      "special": "starter",
      "skins": [
        "default",
        "chrome",
        "gold",
        "iced_out"
      ]
    },
    {
      "id": "auto_pistol",
      "displayName": "Full-Auto Pistol (Switch)",
      "fireMode": "auto",
      "damage": 8,
      "pellets": 1,
      "ratePerSec": 18,
      "spread": "high",
      "mag": 33,
      "reloadSec": 0.9,
      "rangeM": 15,
      "rarity": "rare",
      "pierce": 0,
      "critBonus": 0,
      "knockback": 0,
      "slowMult": 1,
      "muzzleClimb": 0.004,
      "class": "smg",
      "special": "muzzle climb, hose",
      "skins": [
        "default",
        "chrome",
        "gold",
        "iced_out"
      ]
    },
    {
      "id": "draco",
      "displayName": "Draco",
      "fireMode": "auto",
      "damage": 18,
      "pellets": 1,
      "ratePerSec": 10,
      "spread": "med",
      "mag": 30,
      "reloadSec": 1.4,
      "rangeM": 22,
      "rarity": "rare",
      "pierce": 1,
      "critBonus": 0,
      "knockback": 0,
      "slowMult": 1,
      "muzzleClimb": 0,
      "class": "rifle",
      "special": "pierce 1",
      "skins": [
        "default",
        "chrome",
        "gold",
        "iced_out"
      ]
    },
    {
      "id": "drum_draco",
      "displayName": "Drum Draco",
      "fireMode": "auto",
      "damage": 18,
      "pellets": 1,
      "ratePerSec": 10,
      "spread": "med",
      "mag": 100,
      "reloadSec": 2.2,
      "rangeM": 22,
      "rarity": "epic",
      "pierce": 1,
      "critBonus": 0,
      "knockback": 0,
      "slowMult": 1,
      "muzzleClimb": 0,
      "class": "rifle",
      "special": "pierce 1, epic",
      "skins": [
        "default",
        "chrome",
        "gold",
        "iced_out"
      ]
    },
    {
      "id": "micro_smg",
      "displayName": "Micro SMG",
      "fireMode": "auto",
      "damage": 7,
      "pellets": 1,
      "ratePerSec": 20,
      "spread": "high",
      "mag": 32,
      "reloadSec": 1.0,
      "rangeM": 14,
      "rarity": "rare",
      "pierce": 0,
      "critBonus": 0,
      "knockback": 0,
      "slowMult": 1,
      "muzzleClimb": 0.002,
      "class": "smg",
      "special": "fastest fire",
      "skins": [
        "default",
        "chrome",
        "gold",
        "iced_out"
      ]
    },
    {
      "id": "ar_pistol",
      "displayName": "AR Pistol",
      "fireMode": "auto",
      "damage": 14,
      "pellets": 1,
      "ratePerSec": 12,
      "spread": "low",
      "mag": 30,
      "reloadSec": 1.3,
      "rangeM": 22,
      "rarity": "rare",
      "pierce": 0,
      "critBonus": 0.1,
      "knockback": 0,
      "slowMult": 1,
      "muzzleClimb": 0,
      "class": "rifle",
      "special": "+10% crit",
      "skins": [
        "default",
        "chrome",
        "gold",
        "iced_out"
      ]
    },
    {
      "id": "pump",
      "displayName": "Pump Shotgun",
      "fireMode": "pump",
      "damage": 8,
      "pellets": 8,
      "ratePerSec": 1.2,
      "spread": "cone",
      "mag": 6,
      "reloadSec": 2.0,
      "rangeM": 10,
      "rarity": "rare",
      "pierce": 0,
      "critBonus": 0,
      "knockback": 1.5,
      "slowMult": 1,
      "muzzleClimb": 0,
      "class": "shotgun",
      "special": "knockback",
      "skins": [
        "default",
        "chrome",
        "gold",
        "iced_out"
      ]
    },
    {
      "id": "lmg",
      "displayName": "Belt-Fed LMG",
      "fireMode": "auto",
      "damage": 12,
      "pellets": 1,
      "ratePerSec": 15,
      "spread": "med",
      "mag": 150,
      "reloadSec": 3.0,
      "rangeM": 24,
      "rarity": "legendary",
      "pierce": 0,
      "critBonus": 0,
      "knockback": 0,
      "slowMult": 0.6,
      "muzzleClimb": 0,
      "class": "lmg",
      "special": "legendary, slows",
      "skins": [
        "default",
        "chrome",
        "gold",
        "iced_out"
      ]
    },
    {
      "id": "gold_draco",
      "displayName": "Gold Draco",
      "fireMode": "auto",
      "damage": 24,
      "pellets": 1,
      "ratePerSec": 11,
      "spread": "med",
      "mag": 60,
      "reloadSec": 1.4,
      "rangeM": 24,
      "rarity": "legendary",
      "pierce": 2,
      "critBonus": 0,
      "knockback": 0,
      "slowMult": 1,
      "muzzleClimb": 0,
      "class": "rifle",
      "special": "legendary, pierce 2",
      "skins": [
        "default",
        "chrome",
        "gold",
        "iced_out"
      ]
    }
  ]
}